{
 "$schema": "../../../../../../data/schema/run.schema.json",
 "schema_version": 1,
 "proxy": "squid",
 "transport": "tlsfull",
 "matrix": "http",
 "host": "remote",
 "auth": true,
 "started": "2026-10-28T17:19:31+0100",
 "seed": 2004113323,
 "repeat": 3,
 "workers": 1,
 "params": {
  "proxy_cpus": 0,
  "gen_threads": 24,
  "up_threads": 8,
  "sink_threads": 8,
  "gen": "bench-generator",
  "proxy": "bench-proxy",
  "up": "bench-origin-sink"
 },
 "results": [
  {
   "test": "http-1kb-short",
   "mode": "http",
   "workload": {
    "url": "http://172.16.12.2:8000/1kb",
    "conns": 64,
    "budget": "15s",
    "keepalive": false
   },
   "err_kinds": "",
   "measured": {
    "rps": 1921.966,
    "mbps": 1.968,
    "elapsed_s": 15.031,
    "p50_ms": 33.161,
    "p95_ms": 34.079,
    "p99_ms": 34.603,
    "errors": 0.0,
    "reconnects": 0.0
   },
   "generator": {
    "cpu_s_per_run": 8.37,
    "own_rss_mb": 3.9,
    "own_rss_end_mb": 8.9,
    "tls": {
     "negotiated": "TLSv1_3/TLS13_AES_128_GCM_SHA256",
     "resumed": 0.0
    }
   },
   "proxy": {
    "cpu_s_per_run": 15.037,
    "rss_mb": 119.7,
    "peak_rss_mb": 119.7,
    "tcp": {
     "segs_out_per_run": 288839,
     "active_opens_per_run": 2,
     "retrans_per_run": 0,
     "delayed_acks_per_run": 10,
     "listen_overflows": 0,
     "listen_drops": 0
    }
   },
   "saturation": {
    "proxy_util": 1.0,
    "origin_util": 0.0,
    "sink_util": 0.0,
    "flags": []
   },
   "valid": true,
   "problems": []
  },
  {
   "test": "http-1kb-short",
   "mode": "http",
   "workload": {
    "url": "http://172.16.12.2:8000/1kb",
    "conns": 256,
    "budget": "15s",
    "keepalive": false
   },
   "err_kinds": "",
   "measured": {
    "rps": 1916.755,
    "mbps": 1.963,
    "elapsed_s": 15.13,
    "p50_ms": 133.169,
    "p95_ms": 134.218,
    "p99_ms": 135.266,
    "errors": 0.0,
    "reconnects": 0.0
   },
   "generator": {
    "cpu_s_per_run": 8.55,
    "own_rss_mb": 3.9,
    "own_rss_end_mb": 9.6,
    "tls": {
     "negotiated": "TLSv1_3/TLS13_AES_128_GCM_SHA256",
     "resumed": 0.0
    }
   },
   "proxy": {
    "cpu_s_per_run": 15.123,
    "rss_mb": 124.8,
    "peak_rss_mb": 124.8,
    "tcp": {
     "segs_out_per_run": 348069,
     "active_opens_per_run": 0,
     "retrans_per_run": 0,
     "delayed_acks_per_run": 17,
     "listen_overflows": 0,
     "listen_drops": 0
    }
   },
   "saturation": {
    "proxy_util": 1.0,
    "origin_util": 0.0,
    "sink_util": 0.0,
    "flags": []
   },
   "valid": true,
   "problems": []
  },
  {
   "test": "http-1kb-short",
   "mode": "http",
   "workload": {
    "url": "http://172.16.12.2:8000/1kb",
    "conns": 1024,
    "budget": "15s",
    "keepalive": false
   },
   "err_kinds": "",
   "measured": {
    "rps": 1887.66,
    "mbps": 1.933,
    "elapsed_s": 15.544,
    "p50_ms": 541.065,
    "p95_ms": 545.26,
    "p99_ms": 545.26,
    "errors": 0.0,
    "reconnects": 0.0
   },
   "generator": {
    "cpu_s_per_run": 8.81,
    "own_rss_mb": 4.0,
    "own_rss_end_mb": 10.1,
    "tls": {
     "negotiated": "TLSv1_3/TLS13_AES_128_GCM_SHA256",
     "resumed": 0.0
    }
   },
   "proxy": {
    "cpu_s_per_run": 15.537,
    "rss_mb": 167.6,
    "peak_rss_mb": 167.6,
    "tcp": {
     "segs_out_per_run": 353098,
     "active_opens_per_run": 20,
     "retrans_per_run": 0,
     "delayed_acks_per_run": 17,
     "listen_overflows": 0,
     "listen_drops": 0
    }
   },
   "saturation": {
    "proxy_util": 1.0,
    "origin_util": 0.0,
    "sink_util": 0.0,
    "flags": []
   },
   "valid": true,
   "problems": []
  }
 ]
}
